{
  "episodeDate": "2026-10-08",
  "chosenSubject": "The Great Chicago Fire begins",
  "entityType": "event",
  "chosenAngle": "How a city built with too much wood learned hard lessons about safety, planning, and rebuilding",
  "episodeThesis": "A disaster can reveal hidden weaknesses, but careful rebuilding can also change how a city protects people in the future.",
  "timeline": [
    "October 8, 1871: A fire begins at night near DeKoven Street in Chicago.",
    "October 9, 1871: Strong winds and dry wooden buildings help the fire spread through the city.",
    "October 10, 1871: Rain and exhausted firefighting efforts help bring the final flames under control."
  ],
  "storyBeats": [
    "Chicago is growing fast, but much of the city is built from wood, including streets, buildings, docks, and bridges.",
    "A nighttime fire grows into a citywide emergency as wind pushes flames faster than firefighters can stop them.",
    "After the fire, Chicago rebuilds and becomes a lesson in city planning, fire safety, and resilience."
  ],
  "modernRelevance": "Modern cities still use fire codes, building materials, emergency planning, and public warnings to reduce the kind of cascading risk Chicago faced in 1871.",
  "sources": [
    {
      "title": "Library of Congress Research Guide: Great Chicago Fire of 1871",
      "url": "https://guides.loc.gov/chronicling-america-great-chicago-fire",
      "sourceType": "archive"
    },
    {
      "title": "National Archives Museum: 150 Years Ago: The Great Chicago Fire",
      "url": "https://visit.archives.gov/whats-on/explore-exhibits/150-years-ago-great-chicago-fire",
      "sourceType": "official"
    },
    {
      "title": "Library of Congress: The Great conflagration of Chicago. October 8th and 9th, 1871",
      "url": "https://www.loc.gov/item/2007660856/",
      "sourceType": "archive"
    }
  ],
  "safetyNotes": [
    "Discuss loss of life gently and avoid graphic descriptions.",
    "Frame the episode around prevention, community response, and rebuilding."
  ]
}
